{
  "generated_at": "2026-10-27T00:29:13+08:00",
  "timezone": "Asia/Kuala_Lumpur",
  "refresh_interval_hours": 4,
  "stories": [
    {
      "id": "2026-10-27-anthropic-discloses-month-long-training-pause-ai-security-breaches-in-ipo-filing",
      "category": "world",
      "headline": "Anthropic discloses month-long training pause, AI security breaches in IPO filing",
      "summary": "Key points: CNA Latest reports that Anthropic discloses month-long training pause, AI security breaches in IPO filing.",
      "why_it_matters": "This is a global or regional development that may affect risk appetite, trade, energy, technology or geopolitics.",
      "published_at": "2026-10-27T00:16:26+08:00",
      "source_links": [
        {
          "name": "CNA Latest",
          "url": "https://www.channelnewsasia.com/business/anthropic-discloses-month-long-training-pause-ai-security-breaches-in-ipo-filing-6493811",
          "publisher_type": "news"
        },
        {
          "name": "X Channel NewsAsia",
          "url": "https://x.com/ChannelNewsAsia",
          "publisher_type": "social"
        },
        {
          "name": "Facebook Channel NewsAsia",
          "url": "https://www.facebook.com/ChannelNewsAsia",
          "publisher_type": "social"
        }
      ],
      "topics": [
        "latest update"
      ],
      "importance": 4,
      "confidence": "reported_unconfirmed"
    },
    {
      "id": "2026-10-26-nepal-turns-to-smart-s-drones-detection-gear-after-declining-two-malaysian-rescue-",
      "category": "malaysia",
      "headline": "Nepal turns to SMART’s drones, detection gear after declining two Malaysian rescue offers",
      "summary": "Key points: Malaysia’s third offer to assist Nepal in its search and rescue (SAR) operati...",
      "why_it_matters": "This is a Malaysia-focused development that can affect policy, public services, business conditions or local sentiment.",
      "published_at": "2026-10-26T21:00:00+08:00",
      "source_links": [
        {
          "name": "Malay Mail Malaysia",
          "url": "https://www.malaymail.com/news/malaysia/2026/10/26/nepal-turns-to-smarts-drones-detection-gear-after-declining-two-malaysian-rescue-offers/240633",
          "publisher_type": "news"
        }
      ],
      "topics": [
        "latest update"
      ],
      "importance": 3,
      "confidence": "reported_unconfirmed"
    },
    {
      "id": "2026-10-26-we-re-worried-they-hate-us-trump-s-trade-war-leaves-maine-towns-paying-the-price",
      "category": "world",
      "headline": "‘We’re worried they hate us’: Trump’s trade war leaves Maine towns paying the price",
      "summary": "Key points: FORT KENT, Oct 26 — In the heat of US midterm elections, President Donald Trump’s tariffs on Cana...",
      "why_it_matters": "This is a global or regional development that may affect risk appetite, trade, energy, technology or geopolitics.",
      "published_at": "2026-10-26T21:00:00+08:00",
      "source_links": [
        {
          "name": "Malay Mail Money",
          "url": "https://www.malaymail.com/news/money/2026/10/26/were-worried-they-hate-us-trumps-trade-war-leaves-maine-towns-paying-the-price/240666",
          "publisher_type": "news"
        }
      ],
      "topics": [
        "latest update"
      ],
      "importance": 4,
      "confidence": "reported_unconfirmed"
    },
    {
      "id": "2026-10-26-abang-johari-confirms-ai-data-centre-plan-in-sarawak-under-us-50b-investment",
      "category": "malaysia",
      "headline": "Abang Johari confirms AI data centre plan in Sarawak under US$50b investment",
      "summary": "Key points: The US$50 billion investment announced by Prime Minister Datuk Seri Anwar Ibrahim recently...",
      "why_it_matters": "This is a Malaysia-focused development that can affect policy, public services, business conditions or local sentiment.",
      "published_at": "2026-10-26T20:25:57+08:00",
      "source_links": [
        {
          "name": "Malay Mail Malaysia",
          "url": "https://www.malaymail.com/news/malaysia/2026/10/26/abang-johari-confirms-ai-data-centre-plan-in-sarawak-under-us50b-investment/240707",
          "publisher_type": "news"
        }
      ],
      "topics": [
        "latest update"
      ],
      "importance": 3,
      "confidence": "reported_unconfirmed"
    },
    {
      "id": "2026-10-26-live-pig-imports-from-sarawak-to-selangor-subject-to-strict-controls-since-july-20",
      "category": "malaysia",
      "headline": "Live pig imports from Sarawak to Selangor subject to strict controls since July 2025, says deputy minister",
      "summary": "Key points: KUALA LUMPUR, Oct 26 — The import of live pigs from Sarawak to Selangor since July 2025 has been carried out with...",
      "why_it_matters": "This is a Malaysia-focused development that can affect policy, public services, business conditions or local sentiment.",
      "published_at": "2026-10-26T20:13:00+08:00",
      "source_links": [
        {
          "name": "Malay Mail Malaysia",
          "url": "https://www.malaymail.com/news/malaysia/2026/10/26/live-pig-imports-from-sarawak-to-selangor-subject-to-strict-controls-since-july-2025-says-deputy-minister/240706",
          "publisher_type": "news"
        }
      ],
      "topics": [
        "latest update"
      ],
      "importance": 3,
      "confidence": "reported_unconfirmed"
    },
    {
      "id": "2026-10-26-japan-pm-orders-emergency-measures-amid-wave-of-corporate-cyberattacks",
      "category": "world",
      "headline": "Japan PM orders emergency measures amid wave of corporate cyberattacks",
      "summary": "Key points: Japan will draft an emergency cybersecurity policy package in response to a sudden recent wave of...",
      "why_it_matters": "This is a global or regional development that may affect risk appetite, trade, energy, technology or geopolitics.",
      "published_at": "2026-10-26T20:08:13+08:00",
      "source_links": [
        {
          "name": "Malay Mail World",
          "url": "https://www.malaymail.com/news/world/2026/10/26/japan-pm-orders-emergency-measures-amid-wave-of-corporate-cyberattacks/240705",
          "publisher_type": "news"
        }
      ],
      "topics": [
        "latest update"
      ],
      "importance": 4,
      "confidence": "reported_unconfirmed"
    },
    {
      "id": "2026-10-26-bmi-malaysia-among-south-east-asian-economies-facing-el-nino-crop-power-risks",
      "category": "malaysia",
      "headline": "BMI: Malaysia among South-east Asian economies facing El Nino crop, power risks",
      "summary": "Key points: KUALA LUMPUR, Oct 26 — Southern Africa and Southeast Asia are expected to face the sharpest rise in drought, heat...",
      "why_it_matters": "This is a Malaysia-focused development that can affect policy, public services, business conditions or local sentiment.",
      "published_at": "2026-10-26T20:00:01+08:00",
      "source_links": [
        {
          "name": "Malay Mail Money",
          "url": "https://www.malaymail.com/news/money/2026/10/26/bmi-malaysia-among-south-east-asian-economies-facing-el-nino-crop-power-risks/240704",
          "publisher_type": "news"
        }
      ],
      "topics": [
        "latest update"
      ],
      "importance": 3,
      "confidence": "reported_unconfirmed"
    },
    {
      "id": "2026-10-26-japanese-seafood-exports-to-malaysia-jump-40pc-to-rm130m-as-demand-grows",
      "category": "malaysia",
      "headline": "Japanese seafood exports to Malaysia jump 40pc to RM130m as demand grows",
      "summary": "Key points: KUALA LUMPUR, Oct 26 — Japanese seafood exports to Malaysia rose by about 40 per cent in the first eight months of...",
      "why_it_matters": "This is a Malaysia-focused development that can affect policy, public services, business conditions or local sentiment.",
      "published_at": "2026-10-26T19:30:15+08:00",
      "source_links": [
        {
          "name": "Malay Mail Money",
          "url": "https://www.malaymail.com/news/money/2026/10/26/japanese-seafood-exports-to-malaysia-jump-40pc-to-rm130m-as-demand-grows/240702",
          "publisher_type": "news"
        }
      ],
      "topics": [
        "latest update"
      ],
      "importance": 3,
      "confidence": "reported_unconfirmed"
    },
    {
      "id": "2026-10-26-indonesia-lets-listed-firms-buy-back-shares-without-shareholder-approval-until-jun",
      "category": "markets_investment",
      "headline": "Indonesia lets listed firms buy back shares without shareholder approval until June 2027",
      "summary": "Key points: Indonesia’s Financial Services Authority (OJK) said Monday it has extended the policy allo...",
      "why_it_matters": "This can influence markets, currency, rates, corporate earnings or investor positioning.",
      "published_at": "2026-10-26T19:25:01+08:00",
      "source_links": [
        {
          "name": "Malay Mail Money",
          "url": "https://www.malaymail.com/news/money/2026/10/26/indonesia-lets-listed-firms-buy-back-shares-without-shareholder-approval-until-june-2027/240701",
          "publisher_type": "news"
        }
      ],
      "topics": [
        "latest update"
      ],
      "importance": 4,
      "confidence": "reported_unconfirmed"
    },
    {
      "id": "2026-10-26-uk-budget-set-for-limited-relief-as-borrowing-costs-surge",
      "category": "markets_investment",
      "headline": "UK budget set for limited relief as borrowing costs surge",
      "summary": "Key points: British Prime Minister Andy Burnham’s new government unveils its first budget Wednesday, te...",
      "why_it_matters": "This can influence markets, currency, rates, corporate earnings or investor positioning.",
      "published_at": "2026-10-26T19:19:23+08:00",
      "source_links": [
        {
          "name": "Malay Mail Money",
          "url": "https://www.malaymail.com/news/money/2026/10/26/uk-budget-set-for-limited-relief-as-borrowing-costs-surge/240700",